artifacts/reports/ablation/optuna_trials_classification.csv

number,value,datetime_start,datetime_complete,duration,params_colsample_bytree,params_learning_rate,params_max_depth,params_min_child_weight,params_reg_alpha,params_reg_lambda,params_scale_pos_weight,params_subsample,system_attrs_tpe:relative_params:0,state
0,0.6045692452820794,2026-10-20 20:05:17.719445,2026-10-20 20:06:00.392575,0 days 00:00:42.673130,0.696805592132731,0.03912720785647401,8,8,0.0016400214911202306,3.9676050770529883,1.3899863008405067,0.829597545259111,,COMPLETE
1,0.6022563954613438,2026-10-20 20:06:00.393789,2026-10-20 20:06:34.599487,0 days 00:00:34.205698,0.8997327922401265,0.05872031730223161,7,1,0.004705059281907645,0.03549878832196503,1.5308477766956905,0.9409729556485982,,COMPLETE
2,0.6112080595921144,2026-10-20 20:06:34.600462,2026-10-20 20:07:04.561639,0 days 00:00:29.961177,0.8335558684167138,0.034496614656217915,6,5,0.012040216379191714,0.1256277350380703,1.3487346516301046,0.7373687420594126,,COMPLETE
3,0.6096688374492447,2026-10-20 20:07:04.561777,2026-10-20 20:07:36.294467,0 days 00:00:31.732690,0.8277243706586127,0.04528156456471086,7,2,0.1767218232266506,0.03247673570627449,1.1161260317999944,0.8042703315240834,,COMPLETE
4,0.6119765031403086,2026-10-20 20:07:36.294604,2026-10-20 20:08:12.133850,0 days 00:00:35.839246,0.7413841307520113,0.022472426780406705,8,10,0.33959199243313637,0.2091498132903561,1.2441802850159598,0.8925192044349384,,COMPLETE
5,0.6114236448511376,2026-10-20 20:08:12.134053,2026-10-20 20:08:42.637479,0 days 00:00:30.503426,0.7276339944800051,0.02488824083859974,6,1,0.014223612773743576,0.3632486956676606,2.656305710884955,0.9227961206236346,,COMPLETE
6,0.6102683261616599,2026-10-20 20:08:42.637645,2026-10-20 20:09:07.847385,0 days 00:00:25.209740,0.9318496824692567,0.05326639228158821,4,10,0.16278488880914346,5.829384542994738,3.237068376069122,0.8825398470083343,,COMPLETE
7,0.607306292087728,2026-10-20 20:09:07.847508,2026-10-20 20:09:32.301431,0 days 00:00:24.453923,0.7666031869068446,0.02343638084696869,4,1,1.1627201204016835,0.11756010900231852,1.6783725794347397,0.7475990992289793,,COMPLETE
8,0.6079788757781557,2026-10-20 20:09:32.301490,2026-10-20 20:09:56.813038,0 days 00:00:24.511548,0.6723651931039313,0.033085639673402445,6,2,0.7186380986530762,0.039459088111000004,3.4672173415012932,0.8906590942262118,,COMPLETE
9,0.609384778680078,2026-10-20 20:09:56.813158,2026-10-20 20:10:26.670868,0 days 00:00:29.857710,0.8813811040057837,0.02019886832252484,8,8,0.021181366627251397,0.022264204303769682,1.185111629335226,0.8687021504122961,,COMPLETE
10,0.597556830481441,2026-10-20 20:10:26.671012,2026-10-20 20:10:53.611008,0 days 00:00:26.939996,0.7360792901653536,0.07230568675817975,8,10,0.09980591522825141,0.09254936886010967,1.2028640877975874,0.8733314124698766,"{""colsample_bytree"": 0.7360792901653536, ""learning_rate"": 0.07230568675817975, ""max_depth"": 8, ""min_child_weight"": 10, ""reg_alpha"": 0.09980591522825141, ""reg_lambda"": 0.09254936886010967, ""scale_pos_weight"": 1.2028640877975874, ""subsample"": 0.8733314124698766}",COMPLETE
11,0.6106034110625745,2026-10-20 20:10:53.611188,2026-10-20 20:11:17.760276,0 days 00:00:24.149088,0.7123217988202376,0.034115233530711685,6,7,0.06327029908212604,0.7772535103417595,2.223948338012504,0.9240448475116652,"{""colsample_bytree"": 0.7123217988202376, ""learning_rate"": 0.034115233530711685, ""max_depth"": 6, ""min_child_weight"": 7, ""reg_alpha"": 0.06327029908212604, ""reg_lambda"": 0.7772535103417595, ""scale_pos_weight"": 2.223948338012504, ""subsample"": 0.9240448475116652}",COMPLETE
12,0.6105222366778607,2026-10-20 20:11:17.760407,2026-10-20 20:11:46.597270,0 days 00:00:28.836863,0.6672292680479708,0.027409148945709155,8,9,1.909758349345827,0.2144838439375777,1.3230284524135734,0.865697307929444,"{""colsample_bytree"": 0.6672292680479708, ""learning_rate"": 0.027409148945709155, ""max_depth"": 8, ""min_child_weight"": 9, ""reg_alpha"": 1.909758349345827, ""reg_lambda"": 0.2144838439375777, ""scale_pos_weight"": 1.3230284524135734, ""subsample"": 0.865697307929444}",COMPLETE
13,0.6108316089763546,2026-10-20 20:11:46.597419,2026-10-20 20:12:03.920169,0 days 00:00:17.322750,0.8145221721613634,0.020896746627060033,6,7,0.026090270960465706,0.5433617757580441,2.0146933838739787,0.871795879961349,"{""colsample_bytree"": 0.8145221721613634, ""learning_rate"": 0.020896746627060033, ""max_depth"": 6, ""min_child_weight"": 7, ""reg_alpha"": 0.026090270960465706, ""reg_lambda"": 0.5433617757580441, ""scale_pos_weight"": 2.0146933838739787, ""subsample"": 0.871795879961349}",COMPLETE
14,0.6126498610116983,2026-10-20 20:12:03.920247,2026-10-20 20:12:16.922463,0 days 00:00:13.002216,0.7122760431959945,0.024083853877830626,8,2,1.5768145452632603,0.3306596943556052,1.6440274394230356,0.9406245694429358,"{""colsample_bytree"": 0.7122760431959945, ""learning_rate"": 0.024083853877830626, ""max_depth"": 8, ""min_child_weight"": 2, ""reg_alpha"": 1.5768145452632603, ""reg_lambda"": 0.3306596943556052, ""scale_pos_weight"": 1.6440274394230356, ""subsample"": 0.9406245694429358}",COMPLETE
15,0.6103546398714946,2026-10-20 20:12:16.922542,2026-10-20 20:12:27.647268,0 days 00:00:10.724726,0.6783860364845927,0.02367125879817683,8,3,1.995532874384221,0.2252755676571756,1.2370042549838067,0.948612433093104,"{""colsample_bytree"": 0.6783860364845927, ""learning_rate"": 0.02367125879817683, ""max_depth"": 8, ""min_child_weight"": 3, ""reg_alpha"": 1.995532874384221, ""reg_lambda"": 0.2252755676571756, ""scale_pos_weight"": 1.2370042549838067, ""subsample"": 0.948612433093104}",COMPLETE
16,0.6037752857157734,2026-10-20 20:12:27.647366,2026-10-20 20:12:39.607252,0 days 00:00:11.959886,0.6948827507579023,0.036509961614816094,8,3,0.29937836614905394,0.2109286734878518,1.5279969434572567,0.90850095519529,"{""colsample_bytree"": 0.6948827507579023, ""learning_rate"": 0.036509961614816094, ""max_depth"": 8, ""min_child_weight"": 3, ""reg_alpha"": 0.29937836614905394, ""reg_lambda"": 0.2109286734878518, ""scale_pos_weight"": 1.5279969434572567, ""subsample"": 0.90850095519529}",COMPLETE
17,0.6110562808761706,2026-10-20 20:12:39.607323,2026-10-20 20:12:49.853013,0 days 00:00:10.245690,0.7601715798671916,0.022436882115707435,8,8,0.46922346978618545,2.4126483633910647,1.5288287992320695,0.9489983532026504,"{""colsample_bytree"": 0.7601715798671916, ""learning_rate"": 0.022436882115707435, ""max_depth"": 8, ""min_child_weight"": 8, ""reg_alpha"": 0.46922346978618545, ""reg_lambda"": 2.4126483633910647, ""scale_pos_weight"": 1.5288287992320695, ""subsample"": 0.9489983532026504}",COMPLETE
18,0.6105493177293573,2026-10-20 20:12:49.853081,2026-10-20 20:13:00.318739,0 days 00:00:10.465658,0.78371938238078,0.021157698048299704,8,2,2.3906045199370864,0.4129158788120526,1.6174889876338447,0.9276830416455236,"{""colsample_bytree"": 0.78371938238078, ""learning_rate"": 0.021157698048299704, ""max_depth"": 8, ""min_child_weight"": 2, ""reg_alpha"": 2.3906045199370864, ""reg_lambda"": 0.4129158788120526, ""scale_pos_weight"": 1.6174889876338447, ""subsample"": 0.9276830416455236}",COMPLETE
19,0.6094693599472755,2026-10-20 20:13:00.318814,2026-10-20 20:13:11.428377,0 days 00:00:11.109563,0.6553759307407927,0.022218008853307943,8,5,2.1194741574625495,0.19909831101873998,2.4770480227124994,0.9220401474810571,"{""colsample_bytree"": 0.6553759307407927, ""learning_rate"": 0.022218008853307943, ""max_depth"": 8, ""min_child_weight"": 5, ""reg_alpha"": 2.1194741574625495, ""reg_lambda"": 0.19909831101873998, ""scale_pos_weight"": 2.4770480227124994, ""subsample"": 0.9220401474810571}",COMPLETE

docs/Ablation_Study_Comprehensive_Summary.md

### 4.1. Bộ Siêu tham số Tối ưu tìm được bởi Optuna

* **`max_depth`**: 8
* **`learning_rate`**: 0.0241
* **`subsample`**: 0.9406
* **`colsample_bytree`**: 0.7123
* **`scale_pos_weight`**: 1.6440 (giải quyết hiện tượng mất cân bằng lớp trễ)
* **`reg_alpha` (L1)**: 1.5768 | **`reg_lambda` (L2)**: 0.3307
* **`n_estimators`**: 750 cây (kết hợp Early Stopping trên Validation 2023)